teks,topik_tag
teks 1 wajah cantik tubuh aduhai lebih jadi senjata tenis rusia maria sharapova untukk karier dunia fashion tampak sharapova ratus persen tarik dunia fashion padahal dunia glamor dapat pasu luar biasa tetap bersikukuh gelut dunia tenis teks 2 selalu energik optimis kilas tampak sosok noviantika nasution percaya jadi orang nomor satu induk basket tanah air periode 2006 2010 novi pesimis padahal prestasi olahraga indonesia masuk basket tahun puruk sama informasi bahas dua teks sebut dunia mode dan wanita wanita dan olahraga hobi dan dunia mode cantik wanita dan hobi,['teks_berita']
teks berita 1 perintah provinsi dki jakarta mulai sertifikasi sehat unggas sama bagai lokasi besar rp 3 miliar anggar sertifikasi proses sertifikasi unggas hias tanda periksa 11 unggas milik gubernur dki rumah dinas teks berita 2 burung unggas milik gubernur sutiyoso hari gilir burung unggas menteri kompleks widya chandra laku periksa sehat dapat sertifikat sehat tugas datang diam aburizal burung periksa burung nuri kepala hitam beda saji dua teks sebut teks berita 1 siapa berapa bagaimana teks berita 2 kapan bagaimana apa teks berita 1 siapa di mana berapa teks berita 2 kapan di mana siapa teks berita 1 apa berapa kapan teks berita 2 mengapa bagaimana siapa teks berita 1 apa kapan berapa teks berita 2 mengapa apa siapa,['teks_berita']
teks berita 1 perintah thailand akhir perintah pm guling thaksin shinawatra pulang negara perintah turun susul segera mula sidag korupsi jadi thaksin istri pojaman dakwa teks berita 2 jadi buron perintah thailand asing diri luar negeri nama thaksin sinawatra terus sebut kait lidi kasus korupsi biro selidik khusus polisi dsi thailand selasa 19 6 buat nyata kejut perintah mantan pm thailand segera pulang beda saji dua teks berita sebut teks 1 apa kapan di mana teks 2 apa siapa bagaimana teks 1 siapa mengapa kapan teks 2 mengapa bagaimana kapan teks 1 apa di mana bagaimana teks 2 apa bagaimana siapa teks 1 siapa apa bagaimana teks 2 mengapa siapa bagaimana,"['kalimat', 'kalimat_efektif', 'perbaikan_kalimat', 'teks_berita', 'ulasan', 'ulasan_kalimat']"
teks berita 1 perintah thailand akhir perintah pm guling thaksin shinawatra pulang negara perintah turun susul segera mula sidag korupsi jadi thaksin istri pojaman dakwa teks berita 2 jadi buron perintah thailand asing diri luar negeri nama thaksin sinawatra terus sebut kait lidi kasus korupsi biro selidik khusus polisi dsi thailand selasa 19 6 buat nyata kejut perintah mantan pm thailand segera pulang sama informasi dua teks berita sebut perintah thailan akan mulai sidang kasus korupsi thaksin shinawatra lidi khusus polisi pulang paksa mantan pm thailand mantan pm thailand perintah segera pulang karena dakwa korupsi pm thailand perintah segera pulang ke negara thailand karena dapat ampun,"['kalimat', 'kalimat_efektif', 'perbaikan_kalimat', 'teks_berita', 'ulasan', 'ulasan_kalimat']"
tema ajar tentu masa depan cerah rumus masalah tepat karya tulis sesuai tema sebut mengapa cerah masa depan ada pada ajar yang rajin dapar rajin ajar ubah dan tentu masa depan ajar yang bagaimana yang dapat tentu masa depan yang cerah apakah ajar yang rajin itu mampu ubah masa depan jadi cerah,"['larik', 'majas', 'penggalan_puisi', 'puisi', 'ulasan']"
vitamin hasil antioksidanyang tangkal radikal bebas radikal bebas udara bersih hirup organ nafas makin tinggi reaksi antiosidan sendiri makin banyak polusi masuk tubuh vitamin rusa akibat radikal bebas cegah lambat proses tua kulit simpul paragraf sebut tepat konsumsi vitamin a cara atur dapat sehat tubuh radikal bebas adalah udara tidak bersih yang hirup oleh organ nafas kita makin tinggi reaksi antioksidan makin banyak polusi yang masuk ke dalam tubuh rusa pada tubuh akibat radikal bebas dapat cegah dengan mongonsumsi vitamin,['paragraf']
wawan dik beres masalah denga dim sidik ah bodo wan emang dihabisin wawan lho gimana sih bicara baik baik denganny kan teman kan sidik mau sih gitu kayak keras kepala wawan ah engga asal kamu paham karakter sidik pokok tegas apa jadi sudahs siap wawan jangan dik nyaman damai sama kawan bukankah tahun depan uji nasional tentu masa depan sidik seet bu ani datang ayo masuk kelas sebentar latar peristiwa cakap dua siswa kutip teks sebut sore hari dalam kelas di depan kelas saat pulang sekolah siang hari di depan kelas dalam kelas dan saat ajar,"['kalimat', 'kalimat_efektif', 'perbaikan_kalimat', 'ulasan', 'ulasan_kalimat']"
yanti percaya guru guru perlu erti apa pikir butuh gelisahka hari dar tempa rumus rumus hafal melulu yanti pergi tatap terus ikut pergi tinggal asdi asdiarti balik lalu keluar lalu luar kelas lari teriak asdiarti yanti yanti tunggu amanat penggal drama sebut jangan paksa hendak kepada orang lain tidak ada yang bisa baca pikir kita siswa tidak hanya butuh ajar hendak kita tidak mudah bawa arus,['teks_diskusi']
yogyakarta kota hati nyaman cinta bersih buang sampah kali larik tepat lengkap pantun sebut itu slogan indah sekali kendara jalan hati hati pergi ke pasar beli roti tinggal di tempat yang aman,['larik']
yth gumilang jalan yos sudarso no 37 surabaya salam kangen banyumas aku ada segar sehat bulan aku pindah banyumas kamu pernah libur sibuk tugas sekolah aku sekali bagi cerita dulu kalimat buka tepat awal surat pribadi sebut hai apa kabar gum bagaimana kabar bapak dan ibu di sana aku harap sehat sehat selalu saya akan memberitahukan pada gumilang bahwa sekolah di banyumas beda dengan surabaya dengan datang surat ini aku akan abar ada sehat sehat saja sama surat ini aku akan cerita tentang sekolah di smp banyumas,"['kalimat', 'kalimat_efektif', 'perbaikan_kalimat', 'ulasan', 'ulasan_kalimat']"
yth urus osis smp layang pandang bandar sakti hormat rekan rekan urus sos smp layang pandang hadir acara rapat selenggara hari tanggal rabu 10 februari 2005 waktu 13 30 wib tempat sekretaris osis smp layang pandang acara bentuk panitia lomba temu teknolgi sederhana atas hadir rekan rekan ucap terima kasih kalimat tepat isi bagi awal surat dinas sebut kami harap sedia harap kami bahwa untuk hadir acara dengan segala senang hati,"['kalimat', 'kalimat_efektif', 'perbaikan_kalimat', 'ulasan', 'ulasan_kalimat']"
