teks,topik_tag
kalau cerdas pergi pasar beli talas makan rebus dulu siang malam baca buku larik larik kalimat acak sebut jadi pantun bila susun urut 1 4 3 2 2 3 1 4 3 2 1 4 4 2 1 3,"['larik', 'puisi']"
kalimat ungkap alam tarik tiap hari ibu masak gulai makan itu memang suka pagi pagi aku suruh kirim oleh oleh ke rumah kakek ketika belanja ke toko bahagia aku temu dengan teman lama pada waktu itu aku temu kertas kertas cecer di kelas,['kalimat']
kamus bahasa indonesia istilah bawa acara wara presenter ptotokoler host,['teks_diskusi']
kapal laut lihat sembuah titik tengah laut nan jauh titik terus gelinding kuat tiada terjang ombak terpa angin kata tepat lengkap kutip sebut irama sama baris belum gentar kelit jauh geming,['puisi']
kawasan parangkusuma bantul nyata pernah dapat gunung api bukti ada lava sebut watu gilang diri kawasan sebut sungguh sedang ada atas puncak gunung api watu gilang lava beku teliti tim geologi upn yogyakarta isi kutip teks berita sebut tepat teliti watu gilang di kawasan parangkusuma bagai puncak gunung rap watu gilang rupa lava gunung rap yang bantu teliti tim geologi masyarakat banyak yang dapat bahwa watu gilang bagai gunung pai lava yang bentuk di kawasan parangkusuma yang sering diserbut watu gilang,"['kalimat', 'kalimat_efektif', 'perbaikan_kalimat', 'teks_berita', 'ulasan', 'ulasan_kalimat']"
kembang tengah jalan karya armin pane meja hendak hias kembang jauh gunung kau petik sekarang kembang jauh jalan panas hari bunga layu tengah jalan tema puisi sebut indah panorama gunung gelisah orang sahabat kasih yang tidak sampai sedih yang tak kunjung akhir,['puisi']
kereta api lewat puncak nagrek mulai turun bandung lepas tengah hari luncur cepat pikir luncur terus peristiwa malam habis pangandaran tak mungkin agak lepas himpitan pengaruh betapa mungkin peristiwa terlalu hebat jiwa jenis konflik kutip novel sebut fisik lahir batin jasmani,"['larik', 'majas', 'penggalan_puisi', 'puisi', 'ulasan']"
kini aku minta sedia papa serah biaya pesta ringan ongkos masuk sahabat sma manusia sahabat peduli korban,['puisi']
komisi berantas korupsi nilai lembaga eksekutif legislatif 1 2 3 4 tengah hati berantas korupsi lihat ada mau 5 reformasi sistem birokrasi adil 6 7 8 kata kata nomor paragraf sebut tepat susun jadi kamus kecil urut 5 8 3 2 1 4 6 7 5 8 3 1 2 4 6 7 8 3 1 2 4 5 6 7 8 3 2 1 6 5 4 7,['paragraf']
kring guru halo selamat siang siswa guru sendiri apa siswa marwan kelas viia mohon izin masuk sekolah sakit kalimat tepat lengkap cakap sebut halo siapa situ saya ingin bicara dengan pak indra selamat pagi pak bisa saya bicara dengan pak indra selammat pagi apakah anda pak indra saya ingin bicara halo kalau tidak berat saya ingi bicara dengan pak indra,['kalimat']
latar belakang desa suka maju 50 persen anak lulus sd lanjut smp orang tua bagi besar kerja buruh tani rasa mampu biaya anak lanjut sekolah perlu suatu usaha anak anak sebut terus lanjut sekolah rumus masalah tepat latar belakang sebut bagaimana upaya orang tua agar anak lulus sd di desa suka maju dapat lanjut ke smp mengapa harus laku tingkat agar anak lulus sd di desa suka maju bagaimana upaya tingkat persentase lanjut ke smp bagi siswa lulus sd suka maju kapan upaya harus laku agar anak lulus sd di desa suka maju dapat lanjut ke smp,['ulasan']
lelaki buta kemudian coba naik jalan anak anak bantu tarik tangan lek war kali tolak bantu sebut anak anak bantu ambil sandal jepit pasang kaki mulai tampak gigil dingin hampir seluruh tangan basah untung selokan isi air comberan air irigasi air puluh petak sawah belah kampung latar tempat peristiwa kutip cerpen sebut jalan raya selokan sawah kampung,"['cerpen', 'kalimat', 'kalimat_efektif', 'perbaikan_kalimat', 'ulasan', 'ulasan_kalimat']"
majas litotes dapat kamu baru datang ya maaf hidang hanya alakadarnya saja rayu pulau kelapa lambai lambai tulis sangat bagus sampai saya saja tidak bisa baca,['majas']
masuk jenis softnews profil atau kisah sukses orang editorial info wisata dan budaya tahu,['teks_diskusi']
mentari mulai terbit ucap salam selamat pagi burung burung nyanyi riang terbang pilih kata diksi tepat lengkap puisi rumpang sebut di rumput hiau pinggir sawah jalan setapak di angkasa raya,['puisi']
monpera monumen juang rakyat rupa salah satu bangun bangga warga palembang betapa monumen pajang patung burung garuda dinding depan bangun kenang juang rakyat sumatera selatan lawan jajah masa revolusi fisik dikennal tempur lima hari lima malam sini basis juang galang kuat tempur lawan jajah belanda gagas pokok paragraf sebut pajang patung garuda pada monpera bangun bangga warga palembang juang rakyat sumatera selatan pada monpera galang rakyat palembang dalam monpera,['paragraf']
naik bbm tinggi mengangetkan masyarakat bawah jumlah amat nilai naik sangat rasional buru buru alas perintah soal bijak rupa bohong publik gagas utama paragraf sebut sorot harga bbm sangat sering nilai harga bbm tidak rasional naik harga bbm kaget umum bbm sampai masyarakat,"['paragraf', 'teks_berita']"
nana ketua osis baru terima surat osis smp tunas muda nyata kunjung sekolah nana silaturahmi studi banding ajak ada tanding sahabat bola voli putra putri hari sabtu minggu nana ambil putus segera kumpul seluruh urus osis ada rapat bahas minta osis smp tunas muda sebut nana segera tulis pesan singkat sekretaris osis pesan singkat tepat sesuai giat nana laksana segera siap surat yang nyata tidak rat terima kunjung kepada osis smp tunas muda segera siap surat yang nyata rat terima kunjung kepada osis smp tunas muda segera siap surat undang rapat urus osis besok pagi untuk bahasa kunjung osis smp tunas muda segera siap surat undang untuk para urus osis agar pada hari sabtu hadir terima kunjung osis smp tunas muda,"['kalimat', 'kalimat_efektif', 'perbaikan_kalimat', 'ulasan', 'ulasan_kalimat']"
orang juang cerita alam lawan jajah belanda kondisi ekonomi sangat sulit teman temannyaberjang capai merdeka juang hadap belanda sangat berat belanda senjata alat tempur modern juang lawan belanda senjata ada kali tempur juang juang taruh nyawa tetap semangat rebut merdeka puisi tepat lukis alam sebut kami juang usir jajah walau lapar dera senjata bambu runcing meriam musuh dentum bom bom hambur di udara tiada surut semangat kami tuk raih merdeka densingan peluru meriam musuh dentum bom bom berhamburang di udara tiada surut semangat kami tuk raih merdeka terus juang walaupun kami telah tiada kami hanya punya semangat gapai merdeka andai kami semua punya alat yang modern dan canggih kami pasti kalah wahai jajah kami ingin punya negeri yang merdeka tahun tahun kami juang walau kami sudah tiada kami bangga karena negeri kami telah merdeka tetes darah kami untuk mu pertiwi,"['larik', 'majas', 'penggalan_puisi', 'puisi']"
perhati iklan ikut bahasa inggris mudah murah 500 ribu sedia tiga leve semua level gratis ulang loksi jalan pantai indah tanjung pinang kalimat opini iklan sebut tanda nomor 1 dan 2 2 dan 4 3 dan 4 3 dan 5,['teks_diskusi']
perhati ilustrasi ikut hari 17 agustus 2012 dea bahagia terima hadiah piala gubernur menang lomba baca puisi juara i tingkat smp se jakarta kalimat catat hari tepat sesuai ilustrasi sebut aduh betapa malu aku terima hadiah dan piala dari gubernur aku juara i lomba baca puisi antarsiswa aku terima hadiah dan piala dari gubernur karena menang lomba baca puisi se jakarta aku sangat senang terima ini semua aku menang lomba baca puisi sebagaijuara i tingkat smp se jakarta aku terima hadiah dan piala tanggal 17 agustus 2012 aku terima hadiah dan piala dari gubernur karena menang lomba baca puisi aku juara i tingkat smp se jakarta betapa bahagia aku,['teks_diskusi']
perhati ilustrasi ikut kepala sekolah beri mandat wakil laksana giat bakti sosial rangka sambut ramadhan wakil kepala sekolah tugas wali kelas informasi sebut siswa siswa isi pesan singkat tepat dasar ilustrasi sebut kepala sekolah tugas para wali kelas untuk laksana giat bakti sosial demi peduli hadap sama wali kelas harap menginformsikan kepada siswa supaya laksana bakti sosial untuk sambut bulan suci ramadhan kepala sekolah harap semua siswa turut sambut bulan suci ramdhan dengn ada bakti sosial wali kelas kumpul barang apa saja untuk sumbang kepada orang orang yang butuh bantu,['teks_diskusi']
perhati kalimat ikut bapak bapak seluruh ibu ibu hormat sekali baik kalimat paling efektif bapak bapak dan ibu ibu sekali yang kami hormat sekali para bapak bapak dan para ibu sekali yang kami hormat para bapak bapak dan ibu ibu yang sangat kami hormat bapak bapak dan ibu ibu yang kami hormat,['kalimat_efektif']
perhati kalimat ikut kalian kait orang sangkut bila tahu debat lebih jelas guna kata tepat ganti kata cetak miring kalimat sebut sambung bincang hubung soal tali bahas hampir selisih,['ulasan']
perhati kalimat ikut osis smp bina laksana program suluh tema tanggulang penyalahgunaan narkoba datang narasumber rua osis awal suluh rehan sampai pidato isi tuju giat sebut bagi pidato rehan sesuai ilustrasi sebut selamat pagi saya ucap kepada kepala sekolah narasumber bapak dan ibu guru dan teman teman yang telah hadir pada acara ini bapak ibu dan teman teman pertama tama kita panjat syukur hadirat allah yang telah beri nikmat kepada kita sehingga bisa laksana program ini teman teman yang saya sayang giat ini laksana dengan maksud agar kita bisa jaga diri tidak jerumus dan jebak dalam dunia narkoba teman teman sesuai dengan program yang telah pakat mari kita ikut giat ini moga teman teman bisa ambil hikmah,"['larik', 'majas', 'penggalan_puisi', 'puisi']"
perhati kalimat ikut selalu sarap pagi sakit perut olahraga baik kalimat efektif sebut tepat kami selalu sarap pagi agar tidak sakit perut ketika olahraga kami selalu sarap pagi supaya tidak sakit perut ketika olahraga ketika olahraga kami selalu sarap agar tidak sakit perut kami selalu sarap agar tidak sakit perut ketika olahraga,"['kalimat', 'kalimat_efektif', 'perbaikan_kalimat', 'ulasan_kalimat']"
perhati kutip berita ikut perhati hari buruh tanggal 1 mei 2009 isi aksi buruh salah satu isu angkat masalah tinggi timpang jamsostek sedia jamsostek hingga jauh harap 30 juta kerja sector formal indonesia daftar ikut jamsostek baru 9 juta orang kondisi tunjuk banyak usaha abai wajib perlu sosialisasi tindak tegas perintah usah abai jamsostek simpul isi baca sebut sudah saat perintah menudak tegas usaha yang abai jamsostek timpang jamsostek tunjuk ketidakpedulian perusahaanya hadap kerja masalah timpang jamsostek harus secepanya tangan oleh perintah jumlah serta jam jamsostek masih jumlah 9 juta dari 30 juta kerja,"['kalimat', 'kalimat_efektif', 'paragraf', 'perbaikan_kalimat', 'ulasan', 'ulasan_kalimat']"
perhati kutip cerpen ikut 1 batas nama sama nisa nisa 2 namub aku milik sifat pribadi beda jauh 3 bahkan aku milik milik buat ku rasa spesial jadi orang nisa 4 tak sedikit orang orang bahan dunia bangga sangat menyayangu mama tak kecuali aku bukti watak tokoh aku punya sifat sayang cerpen sebut tanda nomor 1 2 3 4,['cerpen']
perhati kutip cerpen ikut mama fati sangat pukul dengar penjelasana dokter fati idap kannker otak mampu ucap apa apa bibir pipi basah hart mohon murah tuhan ibu tegar fati tegar dokter nasehat lembut bibir getar tak mampu ucap cara arang gambar watak mama fati kutip cerpen sebut dialog antar tokoh tingkah laku tokoh cerita oleh arang ungkap oleh tokoh tokoh lain,['cerpen']
perhati kutip drama ikut lurah maling kau bawa kemari wongsokariyo kuat bawa sendiri pak lurah minta bantu tetangga mau berani lancang pak lurah lihat sendiri siapa maling lurah bawa kemari maling lekas wongsokariyo pak lurah apa malu lurah wongsokariyo maling nyata nyata adik lelaki pak lurah sendiri puntung m pudjadi amanat kutip drama sebut kita harus berani hadap risiko apa kita harus hormat kepada pimpin kita kita harus tetap waspada dalam segala situasi kita harus berani tunjuk benar,['teks_diskusi']
perhati kutip lapor ikut pukul 09 00 rombong istana kerpresidenan pukul 11 30 istana presiden baru buka masuk rombong lanjut mulai jajah isi kompleks presiden istana merdeka hadap taman monumen nasional monas istana negara hadap man veteran kalimat tepat lengkap lapor sebut kompleks ke istana presiden diri ata istana negara dan istana merdeka kunjung ke pusat perintah harus ikut atur sana wisata ke istana presiden buka tiap sabtu dan minggu saja siapa pun boleh dateng dari bayi sampai lanjutusia turis asing maupun domestik,['kalimat']
perhati kutip naskah drama ikut denting jam tengah malam tuk sujud ku agung asma mu mohon ampun mu larik majas tepat lengkap kuti an puisi sebut bangun diri dengar nyaring sebut nama mu tepat pukul tiga,"['larik', 'majas', 'penggalan_puisi', 'puisi']"
perhati kutip paragraf ikut 1 perintah cang program wajib ajar sembilan tahun beberapa tahun lalu 2 wajib ajar tuntut perhati semua pihak anak usia sekolah 3 arti anak anak usia 7 s 12 tahun liar kerja tinggal diurmah wajib sekolah 4 sekolah ajar bagai terampil kalimat dapat paragraph sebut tanda nomor 1 2 3 4,['paragraf']
perhati kutip paragraf ikut 1 perintah rencana program wajib ajar sembilan tahun beberapa tahun lalu 2 wajib ajar tuntut perhati semua pihak anak usia sekolah 3 artunya anak anak usia 7 s 12 tahun liar kerja tinggal rumah wajib sekolah 4 seko ajar bagai terampil kalimat dapat paragraf sebut tanda nomor 1 2 3 4,['paragraf']
perhati kutip puisi ikut 1 detak jarum jam 2 satu degup jantung 3 iring desah 4 dentang lonceng habis 5 awal datang ribu empat belas larik 1 4 puisi sebut guna citra asa aba lihat dengar,['puisi']
perhati kutip puisi ikut andai waktu lalu ingin sia sia tak lalu ingin sukses datang sapa larik majas paling tapat isi bagi rumpang puisi sebut ingin milik rasa rindu ingin selalu ingin kata tuju ingin ikhlas datang jemput ingin bahagia hidup,['puisi']
perhati kutip puisi ikut andai waktu lalu ingin sia sia tak lalu ingin sukses datang sapa pesan puisi sebut senang senang belum waktu lalu manfaat waktu yang lalu catat tiap waktu yang lalu jangan sia sia sukses hitung waktu,['puisi']
perhati kutip teks ikut parman keluh mahal biaya masuk sekolah anak banding kondisi didik kini beberapa tahun silam dulu sekolah mahal benar mau protes protes siapa tutur jual tahu goring jadi kerja hari hari parman jalan kusumanegara yogyakarta aktivitas dagang mulai pukul 17 00 21 00 hasil jual kumpul untung bersih rp 30 000 00 per hari uang selalu habis hidup hari hari kritik tepat atas sikap orang tua baca sebut keluh itu kurang baik yang penting tingkat hasil untuk keluarga orang tua perlu damping anak anak hingga mereka dewasa jual makan untuk biaya didik anak sangat lumrah orang tua dapat banding biaya didik antarsekolah,"['kalimat', 'kalimat_efektif', 'perbaikan_kalimat', 'ulasan', 'ulasan_kalimat']"
perhati pantun ikut rawa tatih tatih duduk menung tepi telaga jadi siswa rajin latih tamat siap kerja pantun jawab tepat pantun sebut mau ke mana gunung kejar sudah tinggi banyak dur terima kasih nasihat ajar tentu akan taat beli tikar puluh puluh pakau duduk dua dua pasti capai cita cita bilal ajar sungguh sungguh kerja keras cari uang uang dapat ibu ribu dari mana aku datang tidak perlu kamu tahu sukar sungguh jala teri kejar hilang terus lari ajar harus tiap hari untuk bekal nanti,"['larik', 'majas', 'penggalan_puisi', 'puisi']"
perhati pantun ikut tulis surat malam hari menang adik orang diri menanri ibu tak kunjung pulang tulis sendiri di atas meja malam gelap hitam pekat pakai kertas warna warna pakai klampu tengah terang,"['larik', 'puisi']"
perhati paragraf ikut 1 salah satu bagi sepeda motor penting ban 2 kendara seringkali kurang perhati 3 kurang perhati selamat selamat kendara tentu kondisi ban 4 kendara perlu memperhaitkan kondisi ban kala kalimat utama paragraph sebut dapat nomor 1 2 3 4,"['kalimat', 'kalimat_efektif', 'paragraf', 'perbaikan_kalimat', 'ulasan', 'ulasan_kalimat']"
perhati paragraf ikut bencana banjir lumpur akibat jebol tanggul situ gintung tangerang selatan timbul bagai macam sakit beberapa sakit timbul bencana diare tifus leptospirosis demam darah masalah keseharan korban masyarakat lokasi bencana antisipasi beberapa sakit muncul lingkung kotor sumber air bersih cemar lumpur pikir utama paragraph sebut masalah sehat pada korban harus perhati bencana banjir lumpur akibat jebol tanggul bencana banjir lumpur timbul bagai sakit beberapa sakit mincul karena lingkung kotor,"['kalimat', 'kalimat_efektif', 'paragraf', 'perbaikan_kalimat', 'ulasan', 'ulasan_kalimat']"
perhati paragraf ikut bencana banjir lumpur akibat jebol tanggul situ gintung tanggerangselatan menumbulkan bagai macam sakit beberapa sakit timbul bencana diare tifus leptospirosis demam darah masalah sehat korban masyarakat lokasi bencana antisipasi beberapa sakit muncul lingkung kotor sumber air bersih cemar lumpur gagas utama paragraf sebut masalah sehat pada korban harus di perhati bencana banjir lumpur akibat jebol tanggul bencana banjir lumpur timbul bagai sakit beberapa sakit muncul karena lingkung kotor,['paragraf']
perhati puisi ikut 1 dengar baru jerit 2 antar mimpi tani 3 damba bidang sawah 4 kini ubah 5 jadi rumah rumah mewah larik majas puisi sebut tanda nomor 1 dan 2 2 dan 3 3 dan 4 4 dan 5,"['larik', 'majas', 'penggalan_puisi', 'puisi']"
perhati puisi ikut andai waktu lalu pagi aku tatap larik majas persenifikasi tepat lengkap puisi sebut burung kicau daun hijau bunga bunga mekar embun pagi kilau bunga bunga senyum pada pohon pohin rayu tunggu tegur rumput tumbuh subur udara bersih tidak kandung kapur,['puisi']
perhati puisi ikut laut dadak ramai debur ombak seret angina 1 tengah samudra 2 buih tepi pantai 3 tambah indah suasana larik majas puisi sebut nomor 1 2 3 4,"['larik', 'majas', 'penggalan_puisi', 'puisi']"
perhati puisi ikut rasa hingga kini aku rasa rasa sendiri rasa bimbang rasa tak karuan suatu buat rasa lega puas senyum gembira moga sumber www puisipendek net jenis citra dapat larik puisi sebut lihat asa dengar cium,['puisi']
perhati puisi pantun ikut suka duka waktu bahagia waktu 1 masa tertawa masa 2 tetap cinta mu kata tepat lengkap kutip puisi sebut milik sama rima 1 gembira 2 duka 1 senang 2 bahagia 1 senang 2 gembira 1 derita 2 nestapa,"['larik', 'majas', 'penggalan_puisi', 'puisi']"
perhati tabel ikut tabel kunjung wisatawan asing candi borobudur tahun 2012 2014 no tahun asia amerika australia eropa afrika 1 2012 20 002 20 219 30 112 10 034 10 889 2 2013 20 394 20 325 30 200 10 675 10 234 3 2014 21 234 20 998 31 022 10 985 9 878 nyata yangs esuai tabel tersebuy wisatawan dari asia paling banyak kunjung ke candi borobudur dari tahun ke tahun wisatawan dari australia paling banyak kunjung ke candi borobudur dari tahun ke tahun wisatawan dari eropa paling banyak kunjung ke candi borobudur dari tahun ke tahun wisatawan dari amerika paling banyak kunjung ke candi borobudur dari tahun ke tahun,['paragraf']
perintah perlu laku reformasi pt usaha listrik negara pln pln monopoli pnyediaan listrik seru datang darikalangan usaha rasa pukul krisis listrik pihak swasta hendak milik bangkit bangkit listrik sendiri hendak beri mudah krisis listrik rugi konsumen atas rangkum baca sebut tepat krisis listrik sangat rugi para usaha hal ini sangat rugi konsumen perintah perlu informasi pln dan beri pihak swasta mudah izin perintah hendak mudah izin supaya rugi konsumen dapat atas usaha seru agar perintah laku reformasi pada pt usaha listrik negara,['teks_diskusi']
pisang emas bawa layar masak biji atas peti hutang emas hutang budi bawa mati kata tepat lengkap bagi rumpang puisi sebut tentang duduk desa tentang ketenagakejaan tentang duduk tentang sulit cari kerja,['puisi']
pundi pundi kas negara kini capai 156 triliun per 7 juli 2010 surplus apbn rupa gabung dapat sector paja tambah tari pinjam kemudian rang belanja meski surplus bukan bangga rendah serap belanja sebab fungsi anggar dorong ekonomi jadi kurang efektif dorong kualitas serap anggar tri uang tetap mekanisme reward and punishment arti lembaga serap anggar baik 2010 pagu anggar 2011 potong lambat serap anggar lama tunjuk serius perintah cari solusi bantu lancar serap anggar proses administrasi talu belit belit sederhana kalimat nyata fakta tajuk sebut tedapat kalimat pertama paragraf pertama kalimat tiga paragraf pertama kalimat dua paragraf dua kalimat tiga paragraf dua,['ulasan']
pupuk anorganik guna jangka panjang sebab jadi rusa fisik tanah unsur hara tanah hilang cuci lapis tanah lebih jangkau akar tanam pupuk anorgank potensi bahan cemar guna pupuk efisien lebih rupa tindak boros simpul teks berita sebut guna pupuk anorganik dapat timbul cemar lingkung dan tidak efisien guna pupuk anorganik cara panjang akibat buruk bidang tani guna pupuk anorganik cara lebih dapt hilang unsur hara tanah guna pupuk anorganik dapat sebab rusa fisik tanah dan tidak efisien,['ulasan']
rembulan rembulan kau jalan atas bumi pertiwi sinar agung saat temu malam hari larik majas lengkap puisi sebut dia manfaat sekali rembulan sari bumi cahaya sinar terang engkau senyum pada,"['larik', 'majas', 'penggalan_puisi', 'puisi']"
saat berfikir kritis sikap kritis hidup lebih dinamis sifat rutin semua proses akan jalan kritis memang benar benar sikap perlu informasi temu wacana atas kita harus lihat sikap kritis pada tiap untuk maju proses sikap kritis akan jalan pada tiap orang berfikir kritis hanya milik oleh bagai orang berfikir kritis dapat buat hidup dinamis,['teks_diskusi']
salah satu syarat penuh tulis berita ialah objektif arti berita yang tulis harus sesuai dengan jadi yang benar berita yang tulis tidak pihak berita yang tulis dapat percaya berita yang tulis rupa fakta dan nyata,['teks_diskusi']
sampai pesan masyarakat bangga guna bahasa indonesia baik sampai buah pesan lalu reklame iklan poster slogan,['teks_diskusi']
senja kelabu mentari sembunyi balik awan pohon enggan gerak larik majas lengkap bait puisi sebut satwa giring ke kandang burung diam bisu dahan mulai mongering camar bangan,"['larik', 'majas', 'penggalan_puisi', 'puisi']"
sepeda milik magnet banyak orang bukan anak anak gari sepeda remaja orang dewasa usia produktif hingga orang orang anjak tua senang sepeda bahkan kini sepeda susdah jadi bagi gaya hidup masyarakat kota simpul isi paragraf sebut sepeda dapat jumpa di mana sepeda bagai alat transportasi modern sepeda manfaat bagikeselamatan masyarakat sepeda gari oleh bagai lapis masyarakat,['teks_diskusi']
sepi luar sepi tekan desak kaku pohon tak gerak puncak suasana puisi sebut hening takut haru sedih,['puisi']
sepi luar sepi tekan desak kaku pohon tak gerak puncak tema kutip puisi sebut tekan derita sunyi kaku,['puisi']
siang tadi hari panjang usai bel sekolah dentang aku langsung pulang makan siang sedikit lalu pergi studio music sore pulang pulang aku langsung marah ibu aku diam apa kamu tak ingat berapa jam waktu kamu sia sia tanya ibu nada tinggi aku tunduk lesu aku ingat kata kata sebut ibu kata benar aku sia nyiakan banyak waktu main hirau khawatir ibu aku rasa sangat dosa ibu aku jadi anak durhaka konflik dapat panggil cerita atas konflik batin konflik ide konflik fisik konflik sosial,['ulasan']
singa rupa raja rimba hutan kalimat sebut kandung majas metafora personifikasi ironi paradoks,['majas']
soal ibu maaf ganggu apa lihat samsudin hani samsudin ibu anak hani si sam apa ibu sejak siang pulang padahal makan siang mandi sore sekarang saat makan malam pulang hani apa tadi habis marah didi tadi main lapang bu suasana gambar kutip drama sebut cemas sedih cekam takut,['teks_diskusi']
tabrak mobil mitsubishi l300 nopol h1813 kb parkir nopol dk 8296 ma jalur pantura jalan jendral sudirman kabupaten batang selasa 14 oktober 2013 sebab korban tewas lokasi jadi dua korban tewas tumpang mobil mitsubshi layung suryadi 26th warga jalan genah renah rt 05 rw 05 camat pedurungan semarang agung setiadi selaku kemudi mobil 20th warga genah renah tengah rt 02 rw 02 pedurungan semarang dua korban sebut layung suryadi dan agung setiadi agung setiadi dan oded marka irvan dan hedi tartiana agung laksamana dan indra gumbira,['ulasan']
tabrak mobil mitsubishi l300 nopol h1813 kb parkir nopol dk 8296 ma jalur pantura jalan jendral sudirman kabupaten batang selasa 14 oktober 2013 sebab korban tewas lokasi jadi dua korban tewas tumpang mobil mitsubshi layung suryadi 26th warga jalan genah renah rt 05 rw 05 camat pedurungan semarang agung setiadi selaku kemudi mobil 20th warga genah renah tengah rt 02 rw 02 pedurungan semarang tabrak mobil mitsubishi truk parkir jadi hari selasa 14 oktober 2009 di batang kabupaten semarang hari selasa 14 oktober 2012 di jalan jenderal sudirman kabupaten batang hari selasa 14 oktober 2013 di jalan jenderal sudirman kabupaten batang hari selasa 14 oktober 2013 di pantura jalan jenderal sudirman di batang,['ulasan']
tadi pagi aku ngamuk rasa amukanu terdasyat panjang sejarah kesel banget sumber yah siapa kalau bukan si ijah bantu baru suka bikin takjub orang rumah bayang makalah wira tengah mati buat enak buang tempat sampah tahu betapa besar korban buat makalah tiga malam nyaris tidur bahkan sinetron minggu malam nanti hadir kali paksa aku cuekin eh tahu tahu hasil kerja keras lempar tempat sampah gimana aku kesal biar kamar beranta kaya kapal pecah apa apa asal kertas kertas harga aman ijah ijah kamu kira gampang bikin makalah gampang bikin sambal terasi tokoh ijah kutip cerpen sebut tahu cara dialog antartokoh cerita tokoh lain cerita arang lukis tindak,"['cerpen', 'kalimat', 'kalimat_efektif', 'perbaikan_kalimat', 'ulasan', 'ulasan_kalimat']"
tahu tulis masalah polusi tangan optimal 1 2 3 4 bagi kalimat hilang kalimat efektif 1 2 3 4,"['kalimat', 'kalimat_efektif']"
