teks,topik_tag
1 akhir kang jono memang nikmat hasil apa apa nama malu 2 bahkan lebih 3 tengah malam gelisah genting rumah lempar kali kali 4 kang jono naik pitam 5 keluar rumah hendak lari kejar laku laku 6 sia si 7 akhir masuk engah engah kursi latar waktu suasana kutip cerpen sebut malam hari dan sedih tengah malam dan takut sore hari dan tegang malam hari dan tegang,['cerpen']
1 astaga dewo seru ibu heran mas dewo tertawa apa apa kamu dandan wulan longo 2 gimana oke kan samar akting tadi ibu suruh jemput kamu kan besar wul jadi aku cukup awas pikir asyik kalau aku samar sekali latih akting mas dewo kaka sepupu wulan kuliah institut seni jurus teater 3 mas dewo jahat lihat nih wulan tunjuk lutut luka 4 maaf sebernarnya aku tadi mau tolong kamu malah lari kalimat tunjuk suasana kesal tokoh kutip cerpen sebut tanda dengannomor 1 2 3 4,['cerpen']
1 dengar angin usir batang batang padi 2 matahari tenggelam 3 dengar senandung balik jendela 4 ada sepi 5 rumah kecil buka pintu pagar dasar puisi sebut larik majas sama tanda nomor 1 dan 2 1 dan 3 1 dan 4 1 dan 5,"['larik', 'majas', 'penggalan_puisi', 'puisi']"
1 dengar anin usir batang batang padi 2 matahari benam 3 dengar senandung balik jendela 4 ada sepi 5 rumah kecil buka pintu pagar dasar puisi sebut larik majas sama tanda nomor 1 dan 2 1 dan 3 1 dan 4 1 dan 5,"['majas', 'puisi']"
1 gubernur dki jakarta sutiyoso target tumbuh ekonomi 2007 besar 6 6 2 optimis target capai pemabangunan skala besar dijakarta 3 kondisi ekonomi sisi makro baik 4 inflasi 2006 capai 9 9 2005 mecapai 16 6 tumbuh ekonomi 2006 besar 5 8 5 jadi 2007 tumbuh ekinomi capai target 6 6 kata sutiyoso wartawan kritik target sutiyoso baca sebut kita dukung target sutiyoso pada bidang ekonomi seluruh warrga dki dukung bijak sutiyoso untuk capai target harus serta usaha yang maksimal perintah tanggung jawab dalam capai target didik,['teks_diskusi']
1 jalan tol macet guna rasa rugi 2 blokir jadi sejak kamis malam akhir jumat siang pekan lalu 3 unjuk rasa bongkar sendiri tenda tutup jalan denga tetap tuntun janji bayar ganti rugi cepat 4 besar tuntut rp 3 miliar harga 1 727 meter persegi kalimat isi dapat teks sebut dapat kalimat nomor 1 2 3 4,"['kalimat', 'kalimat_efektif', 'perbaikan_kalimat', 'teks_berita', 'ulasan', 'ulasan_kalimat']"
1 kasih 2 jenak aku sandar bahu 3 nikmat cantik rembulan malam 4 pandang cahaya kerlip bintang larik majas puisi sebut tanda nomor 1 2 3 4,"['larik', 'majas', 'penggalan_puisi', 'puisi']"
1 selamat pag bu bagaimana ada ibu 2 bu ririn ibu buka cabang usaha baru kota 3 selamat bu atas buka cabang usaha ibu 4 buka cabang baru sebut ibu usaha cara legal antara kalimat kalimat wawancara atas sesuai santun bahasa kalimat nomor 1 2 3 4,['kalimat']
1 tahu makan gizi 2 lama tinggal kaki gunung 3 kaki sinta kilir olah raga 4 yudi bawa apel rumah aku pasang kalimat guna kata polisemi tanda nomor 1 dan 2 2 dan 3 3 dan 4 1 dan 4,['teks_diskusi']
1 tempat ilalang bunga putih alun alun sama ayun rumput hembus udara 2 buah lengkung batas bumi langit 3 garis antar metahari tuju istirahat 4 langit kuning muda sisik putih antara jalin warna emas bukti kutip sebut jadi sore hari dapat kalimat nomor 1 2 3 4,['teks_berita']
1 tiba stasiun tugu kereta api siap berangkat 2 tugas jaga pintu peron sangat sopan 3 orang tugas seragam menbantu bawa barang barang kata aku cepat naik 4 senang hati laku kemudian aku cepat cepat cari nomor tempat duduk tera karcis kalimat padu paragraf sebut tanda nomor 1 2 3 4,['kalimat']
abad abad lalu hidup binatang sangat bebas binatang hidup hokum rimba rasa takut liar mana darat laut udara hidup aman paham daging cilia kulit bahkan seluruh bagi tubuh ambil makan pakai aneka hias rupa damba indah imbang alam manusia rasa lindung rasa punah baik kalimat atas teks sebut jadi paragraph padu mereka ada di alam semesta dengan riang gembira mereka bisa terbang ke alam bebas tanpa ada rasa khawatir mereka di mana saja di laut atau di darat tanpa aman mereka rasa aman dari hukum rimba yang laku,['paragraf']
ambil puan merinda pandan jawa roboh tuan bawa adinda badan nyawa kata tepat lengkap teks puisi sebut irama sama larik dua serah tanya punya ragu,"['larik', 'majas', 'penggalan_puisi', 'puisi']"
angkat 45 sebut istilah angkat pujangga angkat balai pustaka angkat chairil anwar angkat pelopor,['teks_diskusi']
baca beri tanda jeda kalimat ikut paling tepat empat rakyat yang pimpin oleh hikmat bijaksana dalam musyawarat wakil empat rakyat yang pimpin oleh hikmat kebijaksaaan dalam musyawarat wakil empat rakyat yang pimpin oleh hikmat kebijaksaaan dalam musyawarat wakil empat rakyat yang pimpin oleh hikmat kebijaksaaan dalam musyawarat wakil,['teks_diskusi']
baca ilustrasi ikut ketua osis smp bintang jaya jogja dapat gilir pertama beri sambut atas nama ketua selenggara acara buka lomba dongeng rangka ingat bulan bahasa buka pidato sesuai ilustrasi sebut lalu lomba dongeng harap generasi muda lebih kenal dan cinta dongeng yang asal dari negeri sendiri dongeng memang sudah tidak nang lagi di kalang anak anak puji sukur mari kita sampai kepada tuhan karena berkat rahmat dan hidayah nya kita dapat kumpul pada acara buka lomba dongeng dalam rangka ingat bulan bahasa demikian yang dapat saya sampai mohon maaf bila ada khilaf kata moga lomba dongeng ini jalan lancar tuju laksana lomba dongeng ini untuk ingat bulan bahasa dengan harap kita generasi muda makin kenal yang asal dari negara sendiri,['ulasan']
baca ilustrasi ikut seksama orang nama amar rasa segala doa tuhan tak pernah kabul duga dosa banyak jadi sebab dosa akibat salah jalan perintah tuhan puisi sesuai ilustrasi sebut marah kau pada hasrat kau abai salah aku doa alun ke arsy mu kurang sujud terima nasib jika kau abai diri kau memang bekuasa atas diri yang hina segala doa sudah lantun segala pinta tiada beri segala kuta tiada sahut besar benar salah arah hampir tahan tumpah berkah hampir tutup pintu restu nanar mata ini tatap bayang baying dosa tak hapus dosa ini dengan segala doa sengaja kau laku ini,['puisi']
baca kalimat ikut kalian kait orang sangkut bila tahu debat lebih jelas guna kata tepat ganti kata gar bawah kalimat sebut sambung bincang hubung soal tali bahas hampir selisih,"['kalimat', 'perbaikan_kalimat']"
baca kalimat ikut semua serta lomba segera masuk ruang seleksi laksana lomba segera mulai baik kalimat sebut efektif kalimat hilang semua lomba masuk segera ke akan semua agar akan serta lomba agar,"['kalimat', 'kalimat_efektif', 'perbaikan_kalimat', 'ulasan', 'ulasan_kalimat']"
baca kalimat ikut semua serta lomba segera masuk ruang seleksi laksana lomba segera mulai baik kalimat sebut efektif kata hilang semua lomba masuk segera ke akan semua agar akan serta lomba agar,['kalimat_efektif']
baca kalimat kalimat ikut mulai setrika bagi paling sulit misal lengan kerah saku basah lebih sedikit air pakai jadi lembab mudah setrika siap semua pakai setrika lanjut setrika bagi lebih mudah gantung lipat pakai rapi jadi tunjuk pakai runtut susun kalimat tepat siap semua pakai yang akan setrika basah lebih dahulu dengan sedikit air agar pakai jadi lembab sehingga mudah setrika mulai setrika dari bagi yang paling sulit misal lengan kerah atau saku lanjut setrika pada bagi yang lebih mudah,"['kalimat', 'kalimat_efektif', 'perbaikan_kalimat', 'ulasan_kalimat']"
baca kutip cerita ikut aku herean kau diam her padahal jelas jelas jono fitnah geram dorman lihat sikap herman tetap tenang hadap jono jelas tuduh gelap uang koperasi biar saja dulu biar jono puas lampias asa hati jawab herman coba beri alas dorman ah dasar jono tahu diri kerja cari cari salah orang pilih jadi ketua koperasi tanda jangan kau lanjut jelas uang jono herman coba batas bicara dorman konflik jadi kutip cerita marah jono kepada dorman masalah uang sabar herman hadap laku dorman ketidaksengajaan jono hadap urus koperasi angkuh herman buat jono fitnah,"['cerpen', 'kalimat', 'kalimat_efektif', 'perbaikan_kalimat', 'ulasan', 'ulasan_kalimat']"
baca kutip cerita ikut aku herean kau diam her padahal jelas jelas jono fitnah geram dorman lihat sikap herman tetap tenang hadap jono jelas tuduh gelap uang koperasi biar saja dulu biar jono puas lampias asa hati jawab herman coba beri alas dorman ah dasar jono tahu diri kerja cari cari salah orang pilih jadi ketua koperasi tanda jangan kau lanjut jelas uang jono herman coba batas bicara dorman watak tokoh herman marah sabar bohong fitnah,"['cerpen', 'kalimat', 'kalimat_efektif', 'perbaikan_kalimat', 'ulasan', 'ulasan_kalimat']"
baca kutip cerita ikut suminah ingat suara anak titin ibu memang egois apa besar salah bu ibu memafkan lanjut titin titin benar suminah orang anak darah daging snediri tega sakit orang tua sendiri ibu hilang orang sekaligus ibu benci kang sapar titin terus rajuk akhir hari suminah luluh atas rajuk titin konflik dapat kutip cerita sebut suminah sangat kenal hadap buat kang sapar suminah hasil rang nafsu atas rajuk titin suminah ragu akan maaf atau tidak buat buruk anak suminah akan maaf perbuatann buruk kkang sapar jika pulang,['cerpen']
baca kutip cerita ikut tatkala matahari condong barat said minta diri sahabaynya pulang lupa said undang makan rumah besok siang beri carik kertas besok siang beri carik kertas teman pergi ibu kota ikan kertas tentara kau temu sana antar rumah latar waktu tempat kutip cerita sebut siang hari di rumah sahabat siang hari di istana said sore hari di rumah sahabat malam hari di istana said,['cerpen']
baca kutip cerpen bawah duduk bawah tugu orang kota sejati aku kan sapu tangan tumput biar pantolan tropikal pakai kotor kemudian aku pandang makan nyala sigaret tempat rindang matahari panas terik hujan pagi nugroho notosusanto latar waktu kutip cerpen sebut pagi hari siang hari sore hari malam hari,['cerpen']
baca kutip cerpen ikut 1 pagi dian duduk kursi roda hadap buah meja 2 atas meja mesin tik 3 tak pernah kecil hati meski karya sering kembali media massa 4 milik semangat besar meski dua kaki patah akibat celaka sepeda motor bukti watak tokoh ana gigih dapat kalimat nomor 1 2 3 4,['cerpen']
baca kutip cerpen ikut cuaca jakarta asai mendung uang setia iring hjan matahari lebih tengah hari delta diri depan jendela kamar buka tatap langit tekah susur airya bumi beri wajah kena tempias hujan kuat ibu hadap hidup ayas nama cinta anak anak tinggal buat delta yakin ibu sumber cinta teladan hidup latar kutip verpen sebut pagi hari di jendela siang hari ke kamar sore hari di jendela siang hari di rumah,['cerpen']
baca kutip cerpen ikut saksama 1 tanam dulu biji sini kata sali kais tanah bawah ujung jari kaki pupuk siram kali hari pagi sore 2 kuncup mulai nyemi hampir aku jingkrak jingkrak tari lantar besar hati 3 usap batang pepaya 4 tiba tiba mata kaca kaca suara jadi keruh aku bapak asuh sejak bayi hingga besar sekat saat lalu tambah sekarang begini ada tebang bacok gorok roboh tak semena mena bukti sali sayang pepaya tunjuk kalimat nomor 1 2 3 4,['cerpen']
baca kutip cerpen ikut saksama kemudian kerja 1 cuaca cerah 2 angin pantai embus sepoi sepoi 3 sebentar matahari tenggelam adu 4 tiba tiba aku sentuh ujung jari 5 kesiap tatap mata akan kata tulus cinta pada hati makin debar latar waktu senja cerpen sebut tunjuk nomor 1 2 3 4,['cerpen']
baca kutip cerpen ikut saksama kemudian kerja 1 cuaca cerah 2 angin pantai embus sepoi sepoi 3 sebentar matahari tenggelam adu 4 tiba tiba aku sentuh ujung jari 5 kesiap tatap mata akan kata tulus cinta pada hati makin debar sudut pandang arang cerpen sebut orang pertama laku utama orang pertama laku samping orang tiga serbatahu orang tiga batas,['cerpen']
baca kutip cerpen ikut saksama kemudian kerja soal ikut 1 hidup sedikit senang 2 sekarang panen ikan baru minggu habis hasil selalu banyak 3 dulu pukat harimau panen ikan nikmat kira kira tiga bulan 4 waktu hasil tangkap beli apa apa 5 sekarang kau lihat sendiri 6 makin melarat sumber ceritaindonesia angelfire com bukti latar suasana cerpen sebut sedih tunjuk kalimat nomor 1 2 4 6,['cerpen']
baca kutip cerpen ikut saksama kemudian kerja soal ikut 1 hidup sedikit senang 2 sekarang panen ikan baru minggu habis hasil selalu banyak 3 dulu pukat harimau panen ikan nikmat kira kira tiga bulan 4 waktu hasil tangkap beli apa apa 5 sekarang kau lihat sendiri 6 makin melarat sumber ceritaindonesia angelfire com sudut pandang arang kutip cerpen sebut orang pertama laku utama orang pertama laku samping orang tiga serba tahu orang tiga batas,['cerpen']
baca kutip cerpen ikut suatu lumpan rasa simpati muncul tiba tiba buat air mata linang dua belah mata lucy kasihan ibu sayang pikir betapa sering lapar asal anak sangat sayang penuh perhati aku penting diri sendiri demikian kemudian dekat ibu letak kepala pangku ibu amanat kutip cerita sebut orang ibu harus tahan lapar demi anak orang ibu harus selalu peluk anak orang anak harus sayang kepada ibu orang anak harus selalu peluk ibu,['cerpen']
baca kutip cerpen ikut suatu lumpan rasa simpati muncul tiba tiba buat air mata linang dua belah mata lucy kasihan ibu sayang pikir betapa sering lapar asal anak sangat sayang penuh perhati aku penting diri sendiri demikian kemudian dekat ibu letak kepala pangku ibu cara arang gambar watak tokoh ibu kutip cerpen sebut dialog antartokoh cerita arang cerita tokoh lain tindak tokoh,['cerpen']
baca kutip drama ikut dini rendy sih kamu selalu usil kamu selalu ejek aku memang kamu suka kalau ejek cemberut rendy tertawa tawa aduh maaf deh kamu marah din dini iya dong habis kamu nakal kamu memang sengaja ejek aku rendy kalimat tepat lengkap kutip drama sebut memang aku sengaja biar anak anak kelas tertawa aku wah jangan marah dong din aku kan cuma canda wah kamu kalau cemberut memang cantik lho jangan marah ya din aku suka lihat cemberut,['ulasan']
baca kutip drama ikut saksama setyani tiap hari uang saku lima ribu rupiah tabung ribu rupiah bapak bapak tuju jangan ribu sekolah rapat kamu pulang pagi besok tabung ribu rupiah waktu olahraga tabung rang jadi ribu jadi kamu ajar sesuai ada setyani pak bapak bapak dulu lalu masuk setyani bawa piring kotor lalu pergi latar tempat kutip drama sebut di sekolah di rumah di toko di warung,['teks_diskusi']
baca kutip puisi ikut perlahan lahan tumbang deru gergaji tangan tangan keji larik majas tepat lengkap puisi sebut daun pun kuning pohon itu gersang pohon itu radang ranting ering,"['larik', 'majas', 'penggalan_puisi', 'puisi']"
baca kutip puisi ikut saksama surat ibu pergi laut lepas anak sayang pergi alam bebas lama hari petang warna senja merah merah tutup pintu waktu lampau citra larik kutip puisi sebut dengar lihat gerak aba,['puisi']
baca kutip puisi ikut sayap sayap burung kecil sepi henti buah taman kota daun jatuh atas bangku bagai mimpi larik majas lengkap kutip puisi sebut makna padu gurau sepi ada sunyi sepi suasana sunyi dapat jatuh bulu warna warni,"['larik', 'majas', 'penggalan_puisi', 'puisi']"
baca kutip puisi ikut tudung langit selalu biru tempat cahaya selalu benderang tempat udara selalu bersih tempat angin selalu nikmat larik majas lengkap bagi rumpang puisi sebut tempat tari si burung camar di tempat sepi di mana hanya di sana ingin kubur di pundak wahai ibu,"['larik', 'majas', 'penggalan_puisi', 'puisi']"
baca kutip surat baca ikut rasa ganggu rusak kotor taman jakur hijau depan sekolah hari tugas keberishan dinas bersih camat sapu sampah sampah sapu angkut hanya sampah sampah ada pinggir jalan sampah tumpuk taman pernah peduli tugas sekolah upaya memberisihkannya sampah lama tumpuk kalimat tepat lengkap kutip surat baca sebut kami siap kok bantu rawat asal ada jalin kerja sama yang jelas apakah tidak ada tugas yang tangan lagi jalur hijau dan taman sebut terus terang kami rasa ganggu terima kasih lalu surat baca ini kami mohon kepada dinas taman dan dinas bersih tiap hari taman dan jalur hijau sebut terima kasih kalau memang tidak mau lagi rawat buang saja sisa sisa pagarbesi dan mati saja pohon pohon sekali lagi tolong pada instansi kait agar peduli keluh kami terima kasih,['teks_diskusi']
baca kutip surat ikut yth urus osis smp setia hati brebes hormat hubung siap laksana bakti sosial harap hadir saudara hari tanggal selasa 17 juli 2012 waktu pukul 14 00 tempat ruang osis acara siap bakti sosial bagi tutup surat sebut tepat demikian surat mohon inikami sampai moga dapat kabul besar harap kami mohon ini ditindaklanjuti sekian dan terima kasih ingat penting acara sebut harap hadir tepat waktu demikian surat pemberitahuan ini sampai,['teks_diskusi']
baca kutip surat pribadi ikut kak desis rindu kak desis aku sampai kakak ibu sangat kangen kakak empat bulan kakak pulang kampung aku tahu kalau kakak sibuk kerja tugas tugas sekolah sibuk orang tua harap kakak datang bandung ibu sangat kangen kakak aku adik cukup sekian surat dari balas surat dai kakak sangat aku nanti nuning kalimat buka surat tepat dengan datang surat ini saya memberitahu kepada kakak bahwa ada kelurga di rumah kangen sama kakak kapan kakak pulang kampung halo kak desis apa kabar mengapa kak desis jarang pulang kampung apa kakak masih punya sibuk bagaimana kabar kakak di jakarta lalu surat ini saya harap ada kakak di jakarta sehat sehat saja sehingga kakak bisa pulang ke bandung kabar kakak aku tunggu hai kak desis apa kabar aku sampai bahwa ada kelurga di bandung dalam ada sehat wal afiat begitu juga daoaku untuk kakak,['teks_diskusi']
baca paragraf ikut 1 kanker tumor ganas tanda tumbuh abnormal sel sel jaring tubuh 2 kanker serang bagai organ penting tubuh manusia 3 faktor sebab turun gaya hidup tubuh sehat 4 kanker serang siapa pandang bulu kalimat dapat paragraf sebut tanda nomor 1 2 1 3 2 3 2 4,['paragraf']
baca paragraf ikut 1 masyarakat jawa milik model adaptasi imigrasi 2 pertama tahan tradisi budaya 3 dua bertranpormasi budaya baru 4 masyarakat jaea migrasi semenanjung malaka suriname serawak buruh kebun karet heterogen tahun 1900 an orang jawa tetap guna simbol budaya jawa nama bahasa kalimat utama paragraf sebut nomor 4 3 2 1,['paragraf']
baca paragraf ikut bagi besar orang kenal soda kue bahan kembang makan khusus kue roti sode kue punya guna makan keguanaan sebut soda kue netral bau asam hilang bau manfaat bersih dasar panci wajan warna hitam nyata soda kue bantu reda sakit maag kembung simpul isi paragraf sebut guna soda kue bagai kembang makan sode kue milik bagai macam menfaat dan guna bagai guna soda kue bagai kembang roti dan kue selain untuk kembang roti soda kue bagai bahan bersih,['paragraf']
baca paragraf ikut banyak bank laku promosi tarik nasabah salah satu bank mapan jaring nasabah bank tawar bagai macam produk serta iming iming hadiah langsung tarik alhasil pamer laku tempat bank jaring 80 nasabah baru kritik tepat baca sebut masyarakat sudah milik sadar untuk tabung untung jaring nasabah memang bank laku promosi kalau tidak ikut pamer bank sulit dapat nasabah baru pihak baru harus jamin aman dana nasabah bukan hanya iming iming,['paragraf']
baca paragraf ikut grup mahasiswa dokter laku ujicoba posko posko bencana banjir sebar bebrapa rw bawa obat obat sumbang milik apotek peduli derita rakyat kena musibah baik pilih cetak miring tepat tim praktikm derita tim tugas derita kelompok praktikm derita kelompok tugas derita,['paragraf']
baca paragraf ikut hidup hari hari manusia gantung sarana komunikasi giat apa laku manusia guna sarana komunikasi sarana komunikasi sarana komunikasi guna manusia sederhana maupun modern budaya manusia maju sekarang ada sarana komunikasi gagas utama paragraf sebut gantung manusia pada sarana komunikasi sarana komunikasi untuk manusia sarana komunikasi bagi tukar budaya tingkat sarana komunikasi modern,['paragraf']
baca paragraf ikut jumlah kunjung wisatawan taman nasional tanjung puting target 15 ribu orang per tahun mulai 2015 target harap penuh lalu kerja sama seluruh pengampua penting tuju capai masing masing mau kerja sama penignkatan kunjung wisatawan ganggu tuju utama daerah konversi wisatawan lama dominasi lancang manca negara gagas utama pararagraf tersebuut target jumlah wisatawan jumlah kunjung wisatawan tingkat kunjung wisatawan unjung domisili lancong manca negara,['paragraf']
baca paragraf ikut kawasan gunung kidul ekosistem jaga daerah sungai bawah tanah air limpah gua sungai huni kelompok kelelawar fitoplankton fitoplankton jadi makan ikan berkembangbiak baik hewan hewan melaya reptil sepertli ular kadal tokek liar burung burung kecil kicau musang lari lari ayam kokok bagai serangga hidup saling pengaruh gagas utama paragraf sebut salah satu gua di gunung kidul huni gua di gunung kidul tempat ekosistem yang masih jaga sungai bawah tanah,['paragraf']
baca paragraf ikut keluarga jadi wahana utama waris adab budaya keluarga bentuk praktik nilai dasar hubung antarmanusia keluarga praktik kesalingpahaman hak wajib sama anggota kelompok keluarga bukan objek mitra subjek program bangun bangsa simpul isi paragraf sebut keluarga rupa tempat utama waris adab dan budaya keluarga tanam nilai dasar hubung antarmanusia keluarga kurang peran bagi bangun bangsa manusia bagai anggota keluarga wajib bangun bangsa,['paragraf']
baca paragraf ikut kuasa dalam kena bahasa rupa tolak ukur hasil orang wartawan mahir bahasa wartawan mudah manipulasi bahasa sesuai tuju capa pilih kata tepat bangkit baca balik pilih kata ceroboh timbul reaksi harap simpul isi paragraf sebut wartawan memang kuasa bahasa wartawan pandai olah bahasa wartawan harus terampil bahasa wartawan pintar manipulasi bahasa,['paragraf']
baca paragraf ikut saksama 1 erupsi jadi pukul 07 30 wib pagi jumat 29 10 2 perubahaan aktifitas cukup cepat 3 lava pijar ikut awan panas bau belerang nampak sembur sejak jumat dini hari tadi 4 awan panas sembur mulut gunung rapi material gugur kata baku teks paragraf sebut dapat kalimat nomor 1 2 3 4,['paragraf']
baca paragraf ikut saksama pakar ikhtiologi simpul pulau toge bangga sulawesi tengah milik banyak jenis ikan khas sana kaji laku kurang tiga pekan catat 800 jenis ikan pulau sebut laku teliti lebih lama lebih banyak dasar 15 terumbu karang tim teliti temu kurang spesies baru teliti sponsor conservation internasional ci buah organisasi lingkung hidup internasional baik kata kata cetak miring paragraf sebut kata jenis ganti dengan kata spesies kata kaji ganti dengan kata teliti kata dasar ganti dengan kata dari kata jenis ganti dengan kata bangsa kata kaji ganti dengan kata teliti kata dasar ganti dengan kata dari kata jenis ganti dengan kata spesies kata kaji ganti dengan kata amat kata dasar ganti dengan kata hasil kata jenis ganti dengan kata variasi kata kaji ganti denga kata selam kata dasar ganti dengan kata dari,['paragraf']
baca puisi bawah seksama 1 mentari mulai terbit 2 awal aku kenal buku 3 raja siang bakar 4 awal aku bakar 5 hujan turun lebat 6 aku khawatir 7 bintang tabur bulan senyum 8 aku pikir 9 malam makin larut 10 aku rasa takut hilang diri larik majas puisi sebut 1 dan 2 5 dan 8 3 dan 7 9 dan 10,"['larik', 'majas', 'penggalan_puisi', 'puisi']"
baca puisi ikut buku kata kau gudang ilmu aku tak tahu wajah balut debu kau sendiri gudang gudang larik majas tepat lengkap puisi sebut di lemari tumpuk tumpuk ilmu apayang sembunyi kau menung sudut lemari buku mana yang akan baca,['majas']
baca puisi ikut puisi i abdi curah segenap asa lapang waktu kadang asa capai kerja ikhlas tulus hari pamrih selalu beri harap nanti nanti datang puisi ii dengin asa lelap kanan kiri aku lempar selimut aku buang enggan malas selalu gerogot fajar singsing aku luncur tempat cari ilmu tuk masa depan nan cerah perbedaab amanat dua puisi sebut puisi i puisi ii jangan engkau sedih jangan malas ke sekolah puisi i puisi ii harap agar cepat hasil lempar selimut jauh jauh tiap pagi puisi i puisi ii kerja dengan ikhlas dan tulus juan untuk capai masa depan puisi i puisi ii sukses pasti akan datang bangun tiap pagi buta,['puisi']
baca puisi ikut saksama papa teman kelas lulus uji nilai tinggi sangat sayang kini aku minta sedia papa serah biaya pesta ringan ongkos masuk sahabat sma tema puisi sebut manusia sahabat peduli korban,['puisi']
baca puisi ikut saksama papa teman kelas lulus uji nilai tinggi sangat sayang kini aku minta sedia papa serah biaya pesta ringan ongkos masuk sahabat sma tema puisi sebut suasana gambar puisi sebut gembira marah risau haru,['puisi']
baca puisi ikut salju mana pergi cari matahari salju turun pohon hilang daun mana jalan cari linkumhan tubuh kuyub pintu tutup tema puisi sebut indah matahari bimbang hati ramah lingkung getir hidup,['puisi']
baca puisi ikut seksama puisi aku karya taufik ismail puisi aku nyanyi sammpai senja umur puisi aku cinta batas cakrawala puisi aku kenang abadi datang tema puisi sebut tuju puisi cinta dalam puis kenang dalam puisi abadi karena puisi,['puisi']
baca puisi ikut situ gintung kala riak air gemuruh malam jelang fajar datang cepat jerat nyawa ibu orang bujur kaku hadap ilahi firasat larik majas lengkap puisi sebut alir deras usik sunyi malam lewat alir sungai malam itu alir tenang di tengah malam bahas larik majas dalam buah puisi adalah larik yang guna kata kata makna kias yang biasa jelas dasar kamus besar bahasa indonesia larik majas dalam puisi sebut adalah usik sunyi malam,"['larik', 'majas', 'penggalan_puisi', 'puisi']"
baca saksama ilustrasi ikut direktur bank amarta minta satpam hadap minta terang kait peristiwa curi bank sebut kepala satpam minta jelas kronologi peristiwa lisan isi pesan singkat tepat dasar ilustrasi sebut jelas kronologi peristiwa curi itu di hadap saya cepat segera hadap saya dan jelas kronologi curi itu cara lisan cepat harap hadap satpam dan jelas kronologi curi itu kami minta saudara buat jelas tentang kronologi curi cara cepat,"['kalimat', 'kalimat_efektif', 'perbaikan_kalimat', 'ulasan', 'ulasan_kalimat']"
