teks,topik_tag
baca seksama kutip cerita ikut begini pak anak jati pagi tadi pulang jual temu dompet pak dalam identitas nama bapak jumlah uang buka seluruh isi ucap ibu jati beri jelas dokter iya alhamdullilah benar bu hilang dompet pagi tadi isis identitas beberapa surat surat penting arti nak jati temu ungkap dokter heryawan iya benar sekali milik alhamdullliah masuh rezeky isi utuh terimakasih banyak nak jati ibu berkat nak jati dompet surat surat penting utuh ucap dokter heryawan nada syukur baik pak segera pamit ucap ibu jati tunggu sebentar bu dokter heryawan masuk keluar bawa bungkus plstik warna hitam dar buat keluarga ibu rumah buat nak jati amanat kutip cerpen sebut tepat jangan pernah ambil barang yang bukan hak buat baik pada orang baik sikap jujur pada diri sendiri sikap jujur pada diri sendiri,['cerpen']
baca seksama puisi ikut blora nikmat blora mimpi masa kanak cinta gagal terlalu hafal citra tonjol larik 1 kutip puisi sebut lihat dengar asa adab,"['larik', 'majas', 'penggalan_puisi', 'puisi']"
baca seksama puisi ikut blora nikmat blora mimpi masa kanak cinta gagal terlalu hafal isi dapat puisi sebut blora yang jadi impi blora yang tidak janji hidup yang baik blora yang janji blora yang janji hidup,"['larik', 'majas', 'penggalan_puisi', 'puisi']"
baca seksama tajuk ikut banyak dengar saksi kiprah rawan bagai susah dunia tolong korban gempa bumi bencana alam lain rawan tolong kaum pinggir aniaya akhir saksi korban rawan coba tebus blockade israel gaza upaya bagi naik kapal mavi marmara korban nyawa derita serang pasu israel syukur meski rawan indonesia luka rawat banyak 10 rawan lain bebas kata lolos maut serang pasu israel serang jadi siapa gugur jadi korban sampai harga tinggi rawan palestina rawan lama bakti diri luhur manusia lihat teladan bukti hidup baru makna dedikasi baik sesame palestina tampak blockade israel amal usik rasa perikemanusiaan rawan tulis tajuk sebut pihak perintah rawan palestina israel,['ulasan']
baca tajuk ikut seksama upaya jaga karya cipta bangsa globalisasi buat gera penting mampu kekang batas batas negara atas nama bebas demokrasi orang lembaga bahkan negara saling klaim kuasa untung satu sama dampak globalisasi landa kaya intelektual budaya pihak pihak luar negeri mudah aku hasil kreativitas karya cipta bahkan budaya hasil cipta tarik untung besar besar harga upaya seniman kebaya kta adjie notonegoro pekan lalu deklarasi kebaya busana wanita indonesia deklarasi perlu sangat desak laku desak sadar hak cipta sangat rendah harga upaya perintah sama perintah daerah tenagn inventaris karya karya seni tradisional sumber daya hayati bagai daerah indonesia sekali jangan lupa paten kenang bangsa punya banyak karya cipta punya hak aku milik ibarat orang ibu lahir aku sang jabang bayi anak sungguh sedih gagas utama tajuk sebut globalisasi buat negara negara di dunia saling kuasa untuk raih untung tiap negara hak klaim kreativitas negera lain bagai karya cipta kita perlu paten karya cipta bangsa agar bangsa lain tidak aku bagai kreativitas kita patut harga upaya pemerinta inventaris karya cipta daerah dari bagai daerah di indonesia,['teks_berita']
baca tajuk ikut seksama upaya jaga karya cipta bangsa globalisasi buat gera penting mampu kekang batas batas negara atas nama bebas demokrasi orang lembaga bahkan negara saling klaim kuasa untung satu sama dampak globalisasi landa kaya intelektual budaya pihak pihak luar negeri mudah aku hasil kreativitas karya cipta bahkan budaya hasil cipta tarik untung besar besar harga upaya seniman kebaya kta adjie notonegoro pekan lalu deklarasi kebaya busana wanita indonesia deklarasi perlu sangat desak laku desak sadar hak cipta sangat rendah harga upaya perintah sama perintah daerah tenagn inventaris karya karya seni tradisional sumber daya hayati bagai daerah indonesia sekali jangan lupa paten kenang bangsa punya banyak karya cipta punya hak aku milik ibarat orang ibu lahir aku sang jabang bayi anak sungguh sedih simpul tajuk sebut globalisasi dampak baik bagi negara negara maju sadar hak cipta bangsa indonesia masih rendah indonesia selalu perangah saksi hebat bangsa lain perintah daerah sudah lama paten budaya daerah,['teks_berita']
baca teks beri seksama demokrasi transisi banyak sekali timbul soal macam soal rugi warga semua anggap wajar asal jangan bablas timbul kesan kacau unjuk rasa serta keras jadi minggu kemarin kota p unjuk rasa picu soal biar larut larut gusur konflik kuasa kelompok gaji hasil kenaikanharga atas langka butuh pokok picu jadi unjuk rasa sisi unjuk rasa dorong cepat selesai bagai masalah perlu tanya berapa jauh unjuk rasa lebih dampak selesai pecah soal gagas utama tajuk sebut pada saat ini unjuk rasa serta keras demokrasi timbul soal yang rugi warga unjuk rasa dalam laksa demokrasi wajar asal tidak biar larut larut unjuk rasa dapat tingkat dan cepat selesai masalah,"['kalimat', 'kalimat_efektif', 'perbaikan_kalimat', 'teks_berita', 'ulasan', 'ulasan_kalimat']"
baca teks beri seksama demokrasi transisi banyak sekali timbul soal macam soal rugi warga semua anggap wajar asal jangan bablas timbul kesan kacau unjuk rasa serta keras jadi minggu kemarin kota p unjuk rasa picu soal biar larut larut gusur konflik kuasa kelompok gaji hasil kenaikanharga atas langka butuh pokok picu jadi unjuk rasa sisi unjuk rasa dorong cepat selesai bagai masalah perlu tanya berapa jauh unjuk rasa lebih dampak selesai pecah soal kalimat fakta kutip tajuk sebut kalimat pertama paragraf pertama kalimat empat paragraf pertama kalimat pertama paragraf dua kalimat tiga paragraf dua,"['kalimat', 'kalimat_efektif', 'perbaikan_kalimat', 'teks_berita', 'ulasan', 'ulasan_kalimat']"
baca teks beri seksama demokrasi transisi banyak sekali timbul soal macam soal rugi warga semua anggap wajar asal jangan bablas timbul kesan kacau unjuk rasa serta keras jadi minggu kemarin kota p unjuk rasa picu soal biar larut larut gusur konflik kuasa kelompok gaji hasil kenaikanharga atas langka butuh pokok picu jadi unjuk rasa sisi unjuk rasa dorong cepat selesai bagai masalah perlu tanya berapa jauh unjuk rasa lebih dampak selesai pecah soal simpul tajuk sebut perintah tidak bisa putus sendiri soal yang ada unjuk rasa picu soal yang biar larut larut demokrasi indonesia masih dalam taraf transisi sehingga banyak soal dalam demokrasi buat bijak dan laksana makan waktu lama,"['kalimat', 'kalimat_efektif', 'perbaikan_kalimat', 'teks_berita', 'ulasan', 'ulasan_kalimat']"
baca teks beri seksama demokrasi transisi banyak sekali timbul soal macam soal rugi warga semua anggap wajar asal jangan bablas timbul kesan kacau unjuk rasa serta keras jadi minggu kemarin kota p unjuk rasa picu soal biar larut larut gusur konflik kuasa kelompok gaji hasil kenaikanharga atas langka butuh pokok picu jadi unjuk rasa sisi unjuk rasa dorong cepat selesai bagai masalah perlu tanya berapa jauh unjuk rasa lebih dampak selesai pecah soal tajuk sebut tahu tulis lebih bepihak rakyat perintah dprd dpr,"['kalimat', 'kalimat_efektif', 'perbaikan_kalimat', 'teks_berita', 'ulasan', 'ulasan_kalimat']"
baca teks ikut seksama 1 hari rabu 20 12 ronaldinho menang ada porta alegre tempat kelahirannta 21 maret 1980 2 peristiwa paling emosional hidup ujar pidato hadap 400 hadirin masuk politik lokal latih brazil dunga asal wilayah porta alegre 3 selalu mimpi jadi akhir jadi nyata 4 rupa gol baik pernah laku ujar main barcelona memang kali menang main baik dunia tahun 2004 2005 nyata rupa fakta teks sebut tanda nomor 4 dan 1 3 dan 2 2 dan 4 1 dan 5,['teks_berita']
baca teks ikut seksama 1 sembur awan panas hangus pohon lereng gunung rapi 2 masyarakat gujnug fenomena sebut mungkin ubah pola pikir warga tinggal desa 3 amat seismograf papar hari catat 15 kali gempa susul 4 semua prihatin nasib warga daerah bahaya sebut kalimat fakta paragraf sebut tanda nomor 1 2 1 3 2 3 3 4,['teks_berita']
baca teks ikut seksama nirmala bonet gadis usia 19 tahun orang tenaga kerja indonesia tki kerja malaysia maksud cari nafkah negeri jiran dapat musibah musibah timpa gadis asal kupang nusa tenggara timur milu sekaligus sayat hati aniaya istri majikan hingga cacat beberapa soal sepele kecil buat nirmala siksa sangat biadab rambut keriting potong terus bakar muka cakar bibir pukul babak bur kepala kening tangan nirmala pukul gelas besi hingga darah paha lengan dada siram air panas kulit kelupas kalimat utama paragraf dua baca sebut dapat kalimat pertama dua tiga empat,['paragraf']
baca teks ikut seksama nirmala bonet gadis usia 19 tahun orang tenaga kerja indonesia tki kerja malaysia maksud cari nafkah negeri jiran dapat musibah musibah timpa gadis asal kupang nusa tenggara timur milu sekaligus sayat hati aniaya istri majikan hingga cacat beberapa soal sepele kecil buat nirmala siksa sangat biadab rambut keriting potong terus bakar muka cakar bibir pukul babak bur kepala kening tangan nirmala pukul gelas besi hingga darah paha lengan dada siram air panas kulit kelupas nyata rupa dapat dapat kalimat pertama paragraf pertama kalimat pertama paragraf dua paragraf pertama kalimat tiga paragraf dua kalimat empat,"['kalimat', 'paragraf', 'ulasan']"
baca tema karya ilmiah ikut tema tingkat prestasi belajarsiswa baca sama rumus masalah tepat sesuai tema sebut siapa saja yang prestasi ajar tingkat kapan kita dapat tingkat prestasi ajar baca bagaimana upaya tingkat prestasi ajar dengan baca sama apakah dengan ajar dapat tingkat prestasi baca sama,"['kalimat', 'kalimat_efektif', 'perbaikan_kalimat', 'ulasan', 'ulasan_kalimat']"
baca tema kaya ilmiah ikut tema tingkat gemar baca siswa baca novel rumus masalah tepat sesuai tema karya sebut siapa yang gemar baca tingkat dengan baca novel bisa gemar baca siswa tingkat dengan baca novel bagaimana tingkat gemar baca siswa dengan novel apakah dengan baca novel dapat tingkat gemar baca buku,['ulasan']
banyak bulan perkara bulan mulia 1 banyak tuhan perkara tuhan mulia tuhan 2 kata kata tepat lengkap larik pantun sebut 1 bulan purnama 2 yang asih 1 bulan di angkasa 2 maha perkasa 1 bulan puasa 2 yang kuasa 1 bulan ribu bulan 2 maha nyanyang,"['larik', 'majas', 'penggalan_puisi', 'puisi']"
banyak prasarana umum kota kota besar urus contoh halte bus halte bus selalu bersih orang tunggu bus rasa nyaman bus dekat stasiun halte banyak sekali coret guna cat semprot pemda tempat perhati biar lebih banyak halte coret coret informasi tentang kutip berita sebut halte bus harus bersih dan nyaman nyata banyak coret prasarana umum di kota kota besar tidak urus oleh pemda coret di halte bus akan makin banyak harus pemda lihat halte bus dekat stasiun,"['kalimat', 'kalimat_efektif', 'perbaikan_kalimat', 'teks_berita', 'ulasan', 'ulasan_kalimat']"
baru beberapa hari keluar penjara kalimat bawah rupa tanya kalimat atas mulai kapan dia keluar dari penjara kapan dia keluar dari penjara berapa lama dia masuk ke dalam penjara sudah berapa hari dia keluar dari penjara,['kalimat']
begini ira rencana lampung kayak gagal sekarang aku tugas anggota paskibra upaca hari sakti pancasila camat aku latih hari sabtu minggu aku rumah maaf aku sahabat vina tutup surat sebut tepat demikian informasi dari saya harap jadi maklum cukup sekian dulu moga jadi periksa ada sekian dulu sobat cinta sampai jumpa besok atau lusa sekian dulu kabar dari mudah mudah kamu tidak kecewa,"['kalimat', 'kalimat_efektif', 'perbaikan_kalimat', 'ulasan', 'ulasan_kalimat']"
berita surat kabar korban sakit flu burung wabah banyak sekali berita banyak korban flu burung lansir hari muka jakarta baik kalimat pertama jadi kalimat efektif letak kata wabah telah kata sakit hilang kata wabah dan sekali pindah kata sudah belum kata sangat tempat kata sudah dan banyak belum kata korban,['kalimat_efektif']
betul betul sedang perlu uang paman pinta danur tengah emis ah kamu anak kemarin kamu percaya aku kan paman tak uang bawa lari sarman teriak tunjuk nunjuk keponakan danur bukan main kejut dengar ria paman buat beberapa warga kampung halaman keluar rumah longok kepala rumah sarman hati iris dengar ucap paman lebih ingat mawarni golek rumah sakit serang demam darah gadis mungil putri lima tahun masuk rumah sakit uang simpan habis beli obat harap uang pinjam paman kembali meski tagih paman cara baik baik hasil nihil habis akal ingat warga kampung punya biasa tabung koperasi warga sulit uang mudah uang pinjam tolong bagi meski sarman masuk hitung amanat tepat sesuai kutip cerita sebut jangan elak dari tanggung jawab buat baik belum tentu dapat balas baik kita urus diri sendiri perlu taruh percaya kepada orang lain,"['cerpen', 'kalimat', 'kalimat_efektif', 'perbaikan_kalimat', 'ulasan', 'ulasan_kalimat']"
betul betul sedang perlu uang paman pinta danur tengah emis ah kamu anak kemarin kamu percaya aku kan paman tak uang bawa lari sarman teriak tunjuk nunjuk keponakan danur bukan main kejut dengar ria paman buat beberapa warga kampung halaman keluar rumah longok kepala rumah sarman hati iris dengar ucap paman lebih ingat mawarni golek rumah sakit serang demam darah gadis mungil putri lima tahun masuk rumah sakit uang simpan habis beli obat harap uang pinjam paman kembali meski tagih paman cara baik baik hasil nihil habis akal ingat warga kampung punya biasa tabung koperasi warga sulit uang mudah uang pinjam tolong bagi meski sarman masuk hitung nilai adat dapat kutip cerita sebut baik sangka dapat pahala biasa tabung untuk saling tolong utang piutang tidak manfaat marah tidak selesai masalah,"['cerpen', 'kalimat', 'kalimat_efektif', 'perbaikan_kalimat', 'ulasan', 'ulasan_kalimat']"
buah cempedak buah durian pergi pekan naik sepeda 1 2 larik tepat lengkap pantun atas 1 jangan ragu buat baik 2 senyum saja sudah ibadah 1 pikir dulu belum tindak 2 sesal kemudian tiada guna 1 supaya tidak sesal kemudian 2 perlu selalu sikp waspada 1 mari kita jalin silatuhrahmi 2 untuk tambah sanak saudara,['larik']
buat salah bagi hidup orang bebas salah sering laku salah wajar perlu buat malu rendah diri jadi jangan takut mencaoba laku bagai coba laku baru bahkan tambah alam kreatifitas asal jangan coba langgar atur baik kalimat sumbang cetak miring paragraf sebut sering laku salah rupa hal yang wajar tidak perlu buat malu apalagi rendah diri sering laku salah adalah hal yang logis tidak perlu buat malu apalagi rendah diri pernah laku salah adalah hal wajar apalagi rendah diri pernah laku salah adalah hal tidak logis tidak perlu buat malu apalagi rendah diri,['kalimat']
bunga tepi jalan tampung debu kendara tumbuh luar karang mati dekap tema kutip puisi sebut senang harus sengsara miskin,"['majas', 'puisi']"
cari masalah diskusi anggota cari masalah diskusi 1 jangan lupa diskusi jalan lancar tentu moderator 2 notulen 3 bahas sama sama masalah kelompok diskusi argumentasi 4 istilah istilah paragraf sebut bila susun jadi kamus kecil tepat 1 2 3 4 2 3 4 1 4 3 1 2 4 1 2 3,['paragraf']
cermat identifikasi masalah ikut identifikasi masalah internet kalang ajar manfaat internet ajar paragraf latar belakang tepat sesuai identifikasi masalah sebut intenet saat ini dapat akses dengan mudah dan murah mereka yang haus informasi dapat cari dari telepon genggam kemudian ini sekaligus bagai tambah tahu dengan demikian tahu siswa akan dapat dari mana saja ajar banyak yang guna internet tahu yang akses dari internet sangat manfaat untuk ajar di sekolah maupun di rumah tahu tidak harus dapat dari guru di sekolah saja salah satu media massa yang popular saat ini adalah internet masuk di kalang ajar mereka bebas akses lagu gambar dan bagai informasi jika tidak fasilitas dampak buruk bagi ajar oleh karena itu perlu dekat yang tepat kepada siswa dalam manfaat internet internet bukan rupa hal baru namun jika guna tidak benar khawatir mereka akan akses hal hal yang sifat negative internet juga dapat guna bagai media ajar,"['paragraf', 'ulasan']"
cermat ilustrasi ikut bulan april smp pelangi nusa ada ingat hari kartini ingat hari kartini tahun 2015 isi lomba pidato cerdas cermat umum menang lomba sampai upacara bendera tanggal 21 april 2015 teks berita dasar ilustrasi sebut tiap bulan april di smp pelangi nusa selalu ada ingat hari kartini tidak kecuali pada tahun 2015 ini giat untuk isi ingat antara lain upa lomba pidato dan cerdas cermat selain itu pada puncak ingat pada tanggal 21 april 2015 ada upacara bendera sekaligus umum menang lomba bagaimana tahun tahun belum tiap bulan april di smp pelangi nusa selalu ada ingat hari kartini tidak kecuali pada tahun 2015 ini giat untuk isi ingat hari kartini ini antara lain aga lomba pidato dan cerdas cermat di samping acara sebut pada puncak ingat pada tanggal 21 april 2015 ada upacara bendera sekaligus sampai umum menang lomba smp pelangi nusa selalu ada ingat hari kartini giat untuk isi ingat hari kartini ini antara lain lomba pidato dan cerdas cermat di samping acara sebut puncak ingat pada tanggal 21 april 2015 ada upacara bendera bulan april 2015 smp pelangi nusa ada ingat hari kartini giat isi dengan lomba pidato dan cerdas cermat puncak ingat ada upacara bendera sekaligus sampai umum menang lomba,['teks_berita']
cermat kalimat ikut hendak sekolah makan ketupat makan bawah pohon randu jadi pantun baik larik tepat lengkap jangan engkau malas malas pasti akan sesal nanti jika kamu giat ajar cita cita pasti akan capai jangan sia sia waktu muda sesal di kemudian hari bajar engkau dengan giat supaya dapat juara satu,"['larik', 'majas', 'penggalan_puisi', 'puisi']"
cermat kalimat ikut kabar kembang mobil listrik benar embus sejak mulai awal tahun 2000 an kalimat tesebut jadi efektif hilang kata tentang sudah mulai tahun,['kalimat_efektif']
cermat kutip naskah drama ikut putri pink sih sedih tahan isak 1 vince mungkin cerah put harap gue sih pilih pink warna merah biru ambil superman putri hitam dipake sama batman gitu kan cubit harap abang dua baik tunjuk laku tepat putri lamun 1 tertawa lamun senyum penasaran,['perbaikan_kalimat']
cermat kutip surat ikut yth kepala smpn 162 jakarta jakarta hormat rangka beri perhati bantu masyarakat mampu mohon saudara kepala sekolah kumpul data siswa keluarga mampu banyak lima puluh orang kalimat tepat lengkap surat sebut atas perhati ucap terima kasih atas perhati kami ucap terima kasih atas hadir saudara kami ucap terima kasih atas kerja sama yang baik kami ucap terima kasih,"['kalimat', 'kalimat_efektif', 'perbaikan_kalimat', 'ulasan', 'ulasan_kalimat']"
cermat penggal puisi ikut alam tempat embun pagi gelayut dedaunan mentari intip balik bukit kecil udara bersih sapa tubuh sejuk bulu bulu kuduk ku diri mengigil sumber brainly co id majas dapat penggal puisi sebut personifikasi hiperbol litotes metonimia,['puisi']
cermat puisi ikut andai esok tak mentari arah langkah henti ketika langit ubah warna kelabu bunga bunga dadak layu larik majas personifikasi lengkap bagi rumpang puisi sebut gerimis pun mulai reda lagi udara asa dingin sekali tanpa lentera akan gelap sekali embun pagi henti nyanyi,['puisi']
cermat puisi ikut kail kali kali kecil keruh sampah kotor ikan ikan tinggal sedikit payah kembang biak ibu sakit suasana puisi sebut sedih keperihatinan khawatir kacau,['puisi']
cermat puisi ikut laut meski terumbu karang jaga abad abad kau hancur alas baris majas personifikasi lengkap puisi sebut laut tak pernah warna abu abu laut tak pernah tanpa sampah laut tak pernah menang laut tak pernah gelombang,['puisi']
cermat puisi ikut masa kecil aku timang timang kasih ibu korban bapak curah batas tema puisi sebut belas kasihan korban kasih sayang berani,['puisi']
cermat tabel ikut tabel hasil angket masyarakat pustaka keliling tahun hasil angket persen baik buruk tahu juli 2005 68 20 12 desember 2005 62 22 16 juli 2006 72 17 11 desember 2006 70 16 14 juli 2007 71 14 15 desember 2007 75 15 10 informasi tepat dasar tabel sebut informasi tentang pustaka keliling yang tidak paham oleh masyarakat jadi pada bulan juli 2007 nilai baik baik tentang pustaka keliling oleh masyarakat jadi pada desember 2007 banding tahun 2005 pada tahun 2006 masyarakat lebih banyak tahu tentang pustaka kelilling nilai masyarakat buruk tentang ada pustaka keliling jadi pada tahun 2006,"['kalimat', 'kalimat_efektif', 'perbaikan_kalimat', 'teks_berita', 'ulasan', 'ulasan_kalimat']"
cermat tulis kalimat ikut tubagus chasan sochib ayahanda gubernur banten ratu atut chosiyah menninggal dina rumah sakit sari asih serang baik kalimat tepat kalimat sebut tubagus chasan sochib ayahanda gubernur banten ratu atut chosiyah tinggal dunia di rumah sakit sari asih serang tubagus chasan sochib ayahanda gubernur banten ratu atut chosiyah tinggal dunia di rumah sakit sari asih serang tubagus chasan sochib ayahanda gubernur banten ratu atut chosiyah tinggal dunia di rumah sakit sari asih serang tubagus chasan sochib ayahanda gubernur banten ratu atut chosiyah tinggal dunia di rumah sakit sari asih serang,"['kalimat', 'kalimat_efektif', 'perbaikan_kalimat', 'ulasan_kalimat']"
dukung gera tanam juta pohon osis smpit adzkia sukabumi maksud selenggara baktisosial lalu giat tanam pohon inspirasi tanam pohon batang beri banyak manfaat slogan sesuai ilustrasi sebut satu pohon demi anak cucu satu pohon juta manfaat ayo tanam sekarang juga hujau lingkung dengan tanam,['teks_diskusi']
dulu akrab kenal makan konsumsi khusus awar sehat jepang bahan dasar aalah ejnsin rumput laut kkhusus hasil merupajan makan kaya kandung serat makan asal rumput laut diri atas jenis serat makan sekaligus serat laut serat larut rendah kalori sekian banyak jenis makan paling kaya kandung serat makan capai 80 9 gr 100 gr saran dasar simpul karya ilmiah sebut untuk jaga sehat baik kita menginsumsi agar agr yang kaya akan kandung serat yang perlu oleh tubuh agar agar rupa makan yang kaya akan kandung serat capai 80 9 gr dalam 100 gr masyarakat di jepang sangat gemar makan agar agar yang kaya akan kandung gizi yang kaya akan kadung serat rumput laut bagai bahan agar agar baik guna bagai bahan kosmetik saja karena kandung gizi yang tinggi,['paragraf']
etimologi arti homo beda kata sama manusia,['teks_diskusi']
gumpal langit mahasempurna bertahta bintang bintang angkasa satu bintang pijar untai turun sapa jenis citra dapat larik dua puisi sebut lihat asa dengar cium,['puisi']
hadirin sekali museum rupa salah satu sumber ajar lalu benda benda pamer museum unjung memperlajari bagai unjung ajar sejarah kembang manusia unjung ajar budaya lingkung masa lalu baik kalimat efektif awal paragraf sebut hadirin museum rupa salah satu sumber ajar para hadirin museum rupa salah satu sumber ajar para hadirin sekali museum rupa salah satu sumber ajar hadirin dan hadirat museum meruoakan salah satu sumber ajar,"['cerpen', 'kalimat', 'kalimat_efektif', 'perbaikan_kalimat', 'ulasan', 'ulasan_kalimat']"
harga bahan pokok pasar cekik leher majas jenis kalimat sebut suara dapat pecah gendang telinga dengan garuda ayah pergi ke papua tadi pagi matahari telah mulai tenggelam ke adu sudah dua hari ini ia tidak kelihatanbatang hidung,['majas']
hati hati kendara patuh atur nyaman jalan sadar selamat semua begitu harap warga kota maksud kalimat dua iklan sebut harus kita sdar akan atur lalu lintas sehingga harap warga penuh kalau kita taat atur lalu linta akan selamat warga kota harus semua orang taat atur lalu lintas agar selamat kalau kita penuh aturanlalu lintas jalan akan nyaman,['teks_diskusi']
hati remuk redam hanafi pulang kampong halaman sumatera barat ibu kembali hanafi rafiah hanafi tolak mungkin jilat liur ludah hanafi sesal tindak mau indah nasihat orang tua derita jalan hidup tak lama kemudian hanafi mati tel empat butir sublimat pesan sirat kutip cerita sebut jangan pulang kampong dalam ada sedih jangan tolak ingin orang tua turut nasihat orang tua jalan hidup sesuai dengan pilih,"['cerpen', 'kalimat', 'kalimat_efektif', 'perbaikan_kalimat', 'ulasan', 'ulasan_kalimat']"
humor 1 sampai cara 2 baik jangan pakai kurang orang cacat 3 teman humor meski lucu jangan sakit hati teman lucu 4 humor bukan humor cerdas kata kata cetak miring paragraph sebut urut bentuk kamus kecil urut tepat 3 2 1 4 5 3 2 5 4 1 3 1 2 4 5 3 2 5 1 4,['paragraf']
ikut ciri ciri poster persuasif singkat tarik bahasa baku,['teks_diskusi']
ikut masuk homonim mekanik itu baik mobil tank dengan batang tang saja di masa sekarang ini banyak sekali jadi gera massa ia lebih suka tonton film seri daripada tanding bola akhir seri kendara sepeda motor sambil pencet hp rawan celaka dan bahaya tulang rawan,['teks_diskusi']
ikut rupa perlu perhati susun rangkum panjang rangkum sesuai dengan panjang pendek buku yang rangkum guna kalimat tungga tahan gagas asli arang tidak masuk gagas buat rangkum,['teks_diskusi']
jadi kau bunga selalu kembang selalu mekar panjang musim basah kemarau jadi kau bunga gar belukar tumbuh kembang mana engkau tabur citra bait puisi sebut lihat dengar aba cium,['puisi']
jadi kau bunga selalu kembang selalu mekar panjang musim basah kemarau jadi kau bunga gar belukar tumbuh kembang tuju kutip puisi sebut dorong tiap orang untuk selalu ikhlas kerja keras dan tahan uji beri semangat agar pantang serah penuh kasih dan percaya diri dorong tiap orang untuk selalu peduli percaya diri dan adaptif ajak untuk maju tahan uji punya semangat hidup dan adaptif,['puisi']
jumlah sandang buta aksara kabupaten sukasari golong tinggi capai 90 000 jiwa atas kondisi pemkab sukasari target 2009 wilayah bebas buta aksara duduk buta aksara sebut papar kepala dinas didik budaya kabupaten sukasari bagi besar 90 rupa usia produktif 14 hingga 44 tahu tinggi buta aksara sebut kait bagai faktor ekonomi rendah sadar didik utama kalang tani lihat sebar buta aksara dominasi camat bagi besar duduk kerja tani kritik tepat pemkab sukasari perlu ada program yang jelas kurang buta aksara nyata kepala dinas didik kurang sejuk masyarakat tani usia produktif perlu tingkat mampu tan tingkat ekonomi tani jadi tanggung jawab dinas budaya,"['kalimat', 'kalimat_efektif', 'perbaikan_kalimat', 'teks_berita', 'ulasan', 'ulasan_kalimat']"
